{
  "schemaVersion": "1.0",
  "kind": "capability",
  "id": "eds.commerce-dropin-block",
  "label": "Commerce drop-in block",
  "category": "data-binding",
  "appliesToStacks": ["eds"],
  "applicability": "saas",
  "detect": "fstab.yaml",
  "fields": [
    { "id": "blockName", "label": "Block name", "type": "text", "validate": "kebab", "default": "product-details" },
    { "id": "dropin", "label": "Drop-in", "type": "select", "options": ["storefront-pdp", "storefront-cart", "storefront-checkout", "storefront-product-discovery", "storefront-recommendations", "storefront-account", "storefront-order"], "default": "storefront-pdp" }
  ],
  "files": [
    { "path": "blocks/${blockName}/${blockName}.js", "template": "block.js" },
    { "path": "blocks/${blockName}/${blockName}.css", "template": "block.css" }
  ],
  "binds": { "service": "Adobe Commerce SaaS drop-ins (@dropins/${dropin})", "via": "drop-in component" },
  "postNote": "Bridges EDS <-> Commerce SaaS: this block mounts a @dropins/${dropin} component. The aem-boilerplate-commerce postinstall provides the drop-in packages; see its docs for the exact container import.",
  "sourceRef": "products/eds/generators/commerce-dropin-block.gen.json (lifted to a capability manifest)"
}
